{
  "architecturalExtractionVersion": "0.1.0",
  "interpretationPolicyVersion": "cad-interpretation-policy-v0.1",
  "profileId": "golden_living_dxf_profile",
  "profileHash": "sha256:8a4429606d348add059c358cb21853f246fa90a85af78b94eca62e351439a40f",
  "source": {
    "cadDocumentVersion": "0.1.0",
    "sourceFormat": "dxf",
    "sourceHash": "sha256:dad0ab0a7863d811d0968dcfad3572337eb33a61cddf06df51df16ce754b096d",
    "cadDocumentHash": "sha256:0c89f758b39c0b6312912a34aed7ec4bc46f24be86c56244a029cef5628f7f26"
  },
  "canonicalUnits": "millimeters",
  "level": {
    "levelCandidateId": "level_candidate_ground",
    "name": "Ground Floor",
    "elevationMm": 0,
    "defaultCeilingHeightMm": 3000,
    "provenance": {
      "name": [
        {
          "authority": "profile",
          "field": "level.name",
          "ruleId": null
        }
      ],
      "elevationMm": [
        {
          "authority": "profile",
          "field": "level.elevationMm",
          "ruleId": null
        }
      ],
      "defaultCeilingHeightMm": [
        {
          "authority": "profile",
          "field": "level.defaultCeilingHeightMm",
          "ruleId": null
        }
      ]
    }
  },
  "spaces": [
    {
      "candidateId": "space_candidate_0000",
      "levelCandidateId": "level_candidate_ground",
      "spaceType": "living_room",
      "labelText": "LIVING ROOM",
      "boundary": [
        [
          0,
          0
        ],
        [
          6000,
          0
        ],
        [
          6000,
          4500
        ],
        [
          0,
          4500
        ]
      ],
      "boundaryWinding": "counter_clockwise",
      "sourceWinding": "counter_clockwise",
      "normalization": "none",
      "floorElevationMm": 0,
      "ceilingHeightMm": 3000,
      "provenance": {
        "boundary": [
          {
            "authority": "cad",
            "sourceOrdinal": 0,
            "sourceHandle": "100",
            "role": "space_boundary"
          },
          {
            "authority": "derived",
            "derivation": "boundary_winding_normalization_v0.1"
          }
        ],
        "spaceType": [
          {
            "authority": "cad",
            "sourceOrdinal": 1,
            "sourceHandle": "101",
            "role": "space_label"
          },
          {
            "authority": "profile",
            "field": "spaceLabelRules.spaceType",
            "ruleId": "living_room_exact"
          }
        ],
        "floorElevationMm": [
          {
            "authority": "profile",
            "field": "level.elevationMm",
            "ruleId": null
          }
        ],
        "ceilingHeightMm": [
          {
            "authority": "profile",
            "field": "level.defaultCeilingHeightMm",
            "ruleId": null
          }
        ]
      }
    }
  ],
  "walls": [
    {
      "candidateId": "wall_candidate_0000_0000",
      "spaceCandidateId": "space_candidate_0000",
      "levelCandidateId": "level_candidate_ground",
      "edgeIndex": 0,
      "start": [
        0,
        0
      ],
      "end": [
        6000,
        0
      ],
      "lengthMm": 6000,
      "baseElevationMm": 0,
      "heightMm": 3000,
      "thicknessMm": 150,
      "referenceLine": "interior_face",
      "thicknessDirection": "exterior_right_of_u",
      "provenance": {
        "geometry": [
          {
            "authority": "cad",
            "sourceOrdinal": 0,
            "sourceHandle": "100",
            "role": "space_boundary"
          },
          {
            "authority": "derived",
            "derivation": "space_boundary_edge_v0.1"
          }
        ],
        "baseElevationMm": [
          {
            "authority": "profile",
            "field": "level.elevationMm",
            "ruleId": null
          }
        ],
        "heightMm": [
          {
            "authority": "profile",
            "field": "level.defaultCeilingHeightMm",
            "ruleId": null
          }
        ],
        "thicknessMm": [
          {
            "authority": "profile",
            "field": "wallDefaults.wallThicknessMm",
            "ruleId": null
          }
        ],
        "referenceConvention": [
          {
            "authority": "derived",
            "derivation": "wall_reference_convention_v0.1"
          }
        ]
      }
    },
    {
      "candidateId": "wall_candidate_0000_0001",
      "spaceCandidateId": "space_candidate_0000",
      "levelCandidateId": "level_candidate_ground",
      "edgeIndex": 1,
      "start": [
        6000,
        0
      ],
      "end": [
        6000,
        4500
      ],
      "lengthMm": 4500,
      "baseElevationMm": 0,
      "heightMm": 3000,
      "thicknessMm": 150,
      "referenceLine": "interior_face",
      "thicknessDirection": "exterior_right_of_u",
      "provenance": {
        "geometry": [
          {
            "authority": "cad",
            "sourceOrdinal": 0,
            "sourceHandle": "100",
            "role": "space_boundary"
          },
          {
            "authority": "derived",
            "derivation": "space_boundary_edge_v0.1"
          }
        ],
        "baseElevationMm": [
          {
            "authority": "profile",
            "field": "level.elevationMm",
            "ruleId": null
          }
        ],
        "heightMm": [
          {
            "authority": "profile",
            "field": "level.defaultCeilingHeightMm",
            "ruleId": null
          }
        ],
        "thicknessMm": [
          {
            "authority": "profile",
            "field": "wallDefaults.wallThicknessMm",
            "ruleId": null
          }
        ],
        "referenceConvention": [
          {
            "authority": "derived",
            "derivation": "wall_reference_convention_v0.1"
          }
        ]
      }
    },
    {
      "candidateId": "wall_candidate_0000_0002",
      "spaceCandidateId": "space_candidate_0000",
      "levelCandidateId": "level_candidate_ground",
      "edgeIndex": 2,
      "start": [
        6000,
        4500
      ],
      "end": [
        0,
        4500
      ],
      "lengthMm": 6000,
      "baseElevationMm": 0,
      "heightMm": 3000,
      "thicknessMm": 150,
      "referenceLine": "interior_face",
      "thicknessDirection": "exterior_right_of_u",
      "provenance": {
        "geometry": [
          {
            "authority": "cad",
            "sourceOrdinal": 0,
            "sourceHandle": "100",
            "role": "space_boundary"
          },
          {
            "authority": "derived",
            "derivation": "space_boundary_edge_v0.1"
          }
        ],
        "baseElevationMm": [
          {
            "authority": "profile",
            "field": "level.elevationMm",
            "ruleId": null
          }
        ],
        "heightMm": [
          {
            "authority": "profile",
            "field": "level.defaultCeilingHeightMm",
            "ruleId": null
          }
        ],
        "thicknessMm": [
          {
            "authority": "profile",
            "field": "wallDefaults.wallThicknessMm",
            "ruleId": null
          }
        ],
        "referenceConvention": [
          {
            "authority": "derived",
            "derivation": "wall_reference_convention_v0.1"
          }
        ]
      }
    },
    {
      "candidateId": "wall_candidate_0000_0003",
      "spaceCandidateId": "space_candidate_0000",
      "levelCandidateId": "level_candidate_ground",
      "edgeIndex": 3,
      "start": [
        0,
        4500
      ],
      "end": [
        0,
        0
      ],
      "lengthMm": 4500,
      "baseElevationMm": 0,
      "heightMm": 3000,
      "thicknessMm": 150,
      "referenceLine": "interior_face",
      "thicknessDirection": "exterior_right_of_u",
      "provenance": {
        "geometry": [
          {
            "authority": "cad",
            "sourceOrdinal": 0,
            "sourceHandle": "100",
            "role": "space_boundary"
          },
          {
            "authority": "derived",
            "derivation": "space_boundary_edge_v0.1"
          }
        ],
        "baseElevationMm": [
          {
            "authority": "profile",
            "field": "level.elevationMm",
            "ruleId": null
          }
        ],
        "heightMm": [
          {
            "authority": "profile",
            "field": "level.defaultCeilingHeightMm",
            "ruleId": null
          }
        ],
        "thicknessMm": [
          {
            "authority": "profile",
            "field": "wallDefaults.wallThicknessMm",
            "ruleId": null
          }
        ],
        "referenceConvention": [
          {
            "authority": "derived",
            "derivation": "wall_reference_convention_v0.1"
          }
        ]
      }
    }
  ],
  "openings": [
    {
      "candidateId": "opening_candidate_0000",
      "hostWallCandidateId": "wall_candidate_0000_0003",
      "spaceCandidateId": "space_candidate_0000",
      "blockName": "DOOR_900_LH_IN",
      "sourceCenter": [
        0,
        1650
      ],
      "sourceRotationDegrees": 270,
      "hostDistanceMm": 0,
      "offsetMm": 2400,
      "widthMm": 900,
      "heightMm": 2100,
      "sillMm": 0,
      "type": "door",
      "hingeSide": "start_jamb",
      "swingDirection": "into_room",
      "provenance": {
        "center": [
          {
            "authority": "cad",
            "sourceOrdinal": 2,
            "sourceHandle": "102",
            "role": "door_insert"
          }
        ],
        "host": [
          {
            "authority": "cad",
            "sourceOrdinal": 2,
            "sourceHandle": "102",
            "role": "door_insert"
          },
          {
            "authority": "derived",
            "derivation": "opening_host_projection_v0.1"
          }
        ],
        "offsetMm": [
          {
            "authority": "cad",
            "sourceOrdinal": 2,
            "sourceHandle": "102",